{
  "generated_at": "2026-08-17T19:34:55.896Z",
  "schema_version": "1.1.0",
  "count": 60,
  "categories": {
    "professional": 20,
    "creative": 12,
    "personality": 14,
    "specialized": 10,
    "experimental": 4
  },
  "personas": [
    {
      "id": "ada-kim",
      "name": "Ada Kim",
      "category": "specialized",
      "subcategory": "documentation",
      "tags": [
        "documentation",
        "technical-writing",
        "tutorials",
        "examples",
        "docs"
      ],
      "short_description": "Technical writer who produces task-oriented docs people can follow, with examples, not marketing.\n",
      "path": "personas/specialized/ada-kim.yaml",
      "version": "1.0.0",
      "status": "stable"
    },
    {
      "id": "ada-vale",
      "name": "Ada Vale",
      "category": "professional",
      "subcategory": "systems",
      "tags": [
        "systems",
        "sre",
        "reliability",
        "debugging",
        "distributed-systems"
      ],
      "short_description": "Senior systems engineer who treats outages as puzzles in incentives, coupling, and time.",
      "path": "personas/professional/ada-vale.yaml",
      "version": "1.0.0",
      "status": "stable"
    },
    {
      "id": "amara-singh",
      "name": "Amara Singh",
      "category": "professional",
      "subcategory": "psychology",
      "tags": [
        "psychology",
        "clinical",
        "boundaries",
        "skills",
        "evidence"
      ],
      "short_description": "Clinical psychologist who teaches skills and evidence — and refuses to be your therapist.\n",
      "path": "personas/professional/amara-singh.yaml",
      "version": "1.0.0",
      "status": "stable"
    },
    {
      "id": "anya-solis",
      "name": "Anya Solis",
      "category": "creative",
      "subcategory": "documentary",
      "tags": [
        "documentary",
        "editing",
        "structure",
        "ethics",
        "footage"
      ],
      "short_description": "Documentary editor who finds structure in footage and facts, and will not cut a person into a falsehood.\n",
      "path": "personas/creative/anya-solis.yaml",
      "version": "1.0.0",
      "status": "stable"
    },
    {
      "id": "ash-vale",
      "name": "Ash Vale",
      "category": "specialized",
      "subcategory": "intelligence",
      "tags": [
        "intelligence",
        "analysis",
        "hypotheses",
        "indicators",
        "collection"
      ],
      "short_description": "Intelligence analyst who separates collection from inference and names competing hypotheses.\n",
      "path": "personas/specialized/ash-vale.yaml",
      "version": "1.0.0",
      "status": "stable"
    },
    {
      "id": "attalus",
      "name": "Attalus",
      "category": "personality",
      "subcategory": "stoic",
      "tags": [
        "stoic",
        "agency",
        "control",
        "virtue",
        "counsel"
      ],
      "short_description": "Stoic counselor who separates what is yours from what is not, then returns you to agency.\n",
      "path": "personas/personality/attalus.yaml",
      "version": "1.0.0",
      "status": "stable"
    },
    {
      "id": "aunt-lin",
      "name": "Aunt Lin",
      "category": "personality",
      "subcategory": "mentor",
      "tags": [
        "mentor",
        "growth",
        "honesty",
        "encouragement",
        "development"
      ],
      "short_description": "Warm mentor who tells you the truth because she believes you can grow, not because she enjoys the sting.\n",
      "path": "personas/personality/aunt-lin.yaml",
      "version": "1.0.0",
      "status": "stable"
    },
    {
      "id": "briggs",
      "name": "Briggs",
      "category": "personality",
      "subcategory": "advocate",
      "tags": [
        "advocate",
        "loyalty",
        "boundaries",
        "negotiation",
        "protection"
      ],
      "short_description": "Loyal advocate who stays in your corner, clarifies what you want, and helps you not get rolled.\n",
      "path": "personas/personality/briggs.yaml",
      "version": "1.0.0",
      "status": "stable"
    },
    {
      "id": "calder-finch",
      "name": "Calder Finch",
      "category": "creative",
      "subcategory": "oral-story",
      "tags": [
        "oral-story",
        "cadence",
        "voice",
        "campfire",
        "tellable"
      ],
      "short_description": "Oral storyteller who builds tales you can say aloud: cadence, refrain, and a shape a listener can retell.\n",
      "path": "personas/creative/calder-finch.yaml",
      "version": "1.0.0",
      "status": "stable"
    },
    {
      "id": "celeste-ward",
      "name": "Celeste Ward",
      "category": "specialized",
      "subcategory": "grants",
      "tags": [
        "grants",
        "proposals",
        "funders",
        "evaluation",
        "aims"
      ],
      "short_description": "Grant and proposal writer who follows funder logic, aims, and evaluation — and will not inflate claims.\n",
      "path": "personas/specialized/celeste-ward.yaml",
      "version": "1.0.0",
      "status": "stable"
    },
    {
      "id": "cross-debate",
      "name": "Cross Debate",
      "category": "specialized",
      "subcategory": "debate",
      "tags": [
        "debate",
        "argumentation",
        "burdens",
        "opposition",
        "rhetoric"
      ],
      "short_description": "Structured debate opponent who argues a side with rules, concessions, and burdens.",
      "path": "personas/specialized/cross-debate.yaml",
      "version": "1.0.0",
      "status": "stable"
    },
    {
      "id": "devin-cho",
      "name": "Devin Cho",
      "category": "professional",
      "subcategory": "economics",
      "tags": [
        "economics",
        "labor",
        "incentives",
        "empirics",
        "policy"
      ],
      "short_description": "Labor economist who follows incentives and identification, not tribal talking points.",
      "path": "personas/professional/devin-cho.yaml",
      "version": "1.0.0",
      "status": "stable"
    },
    {
      "id": "elena-voss",
      "name": "Elena Voss",
      "category": "professional",
      "subcategory": "law",
      "tags": [
        "law",
        "advocacy",
        "argument",
        "evidence",
        "writing"
      ],
      "short_description": "Trial lawyer who builds case theory from facts, then pressure-tests it like opposing counsel.\n",
      "path": "personas/professional/elena-voss.yaml",
      "version": "1.0.0",
      "status": "stable"
    },
    {
      "id": "ellis-crowe",
      "name": "Ellis Crowe",
      "category": "personality",
      "subcategory": "skeptic",
      "tags": [
        "skeptic",
        "evidence",
        "claims",
        "humor",
        "empiricism"
      ],
      "short_description": "Dry empirical skeptic who meets every confident claim with 'show me the study' and a raised eyebrow.\n",
      "path": "personas/personality/ellis-crowe.yaml",
      "version": "1.0.0",
      "status": "stable"
    },
    {
      "id": "evander",
      "name": "Evander",
      "category": "personality",
      "subcategory": "taste",
      "tags": [
        "taste",
        "aesthetics",
        "editing",
        "restraint",
        "beauty"
      ],
      "short_description": "Melancholic aesthete who edits for beauty, restraint, and what is worth keeping after the cut.\n",
      "path": "personas/personality/evander.yaml",
      "version": "1.0.0",
      "status": "stable"
    },
    {
      "id": "freya-lind",
      "name": "Freya Lind",
      "category": "professional",
      "subcategory": "climate",
      "tags": [
        "climate",
        "uncertainty",
        "earth-system",
        "risk",
        "communication"
      ],
      "short_description": "Climate scientist who separates robust findings from skinny tails and political weather.",
      "path": "personas/professional/freya-lind.yaml",
      "version": "1.0.0",
      "status": "stable"
    },
    {
      "id": "grit",
      "name": "Grit",
      "category": "experimental",
      "subcategory": "code-goblin",
      "tags": [
        "experimental",
        "debugging",
        "code",
        "ugly-fixes",
        "voice"
      ],
      "short_description": "Feral code goblin who names the smell and ships the ugly patch that stops the bleeding.",
      "path": "personas/experimental/grit.yaml",
      "version": "1.0.0",
      "status": "stable"
    },
    {
      "id": "harlan-webb",
      "name": "Harlan Webb",
      "category": "professional",
      "subcategory": "constitutional-law",
      "tags": [
        "constitutional-law",
        "doctrine",
        "history",
        "interpretation",
        "public-law"
      ],
      "short_description": "Constitutional scholar who maps doctrine and history without campaigning from the bench.",
      "path": "personas/professional/harlan-webb.yaml",
      "version": "1.0.0",
      "status": "stable"
    },
    {
      "id": "harrington",
      "name": "Harrington",
      "category": "personality",
      "subcategory": "diplomacy",
      "tags": [
        "diplomacy",
        "protocol",
        "courtesy",
        "face",
        "rooms"
      ],
      "short_description": "Diplomatic formalist who uses protocol and face-saving courtesy to get a decision through a room.\n",
      "path": "personas/personality/harrington.yaml",
      "version": "1.0.0",
      "status": "stable"
    },
    {
      "id": "haruto-shin",
      "name": "Haruto Shin",
      "category": "creative",
      "subcategory": "art-direction",
      "tags": [
        "art-direction",
        "composition",
        "visual-systems",
        "references",
        "boards"
      ],
      "short_description": "Art director who turns a brief into composition, palette, type, and a reference system you can shoot or draw.\n",
      "path": "personas/creative/haruto-shin.yaml",
      "version": "1.0.0",